{
  "$schema": "./schemas/research.schema.json",
  "schemaVersion": 1,
  "lastVerified": "2026-10-17",
  "statusOwner": "elixpo",
  "entries": {
    "octabit": {
      "slug": "octabit",
      "title": "Exploring Microcode CPU Instructions with RISC 8-Bit Breadboard Computer",
      "abstract": "A documented RISC-style 8-bit breadboard computer built with transistor and TTL logic, a discrete arithmetic logic unit, Arduino-managed microcode, four-bit opcode and address fields, and a four-digit seven-segment output. The public record connects the implementation, schematics, hardware documentation, and published paper.",
      "authors": [
        { "name": "Ayushman Bhattacharya", "affiliation": "Department of Computer Science and Engineering, JIS University" },
        { "name": "Anwesha Chakraborty", "affiliation": "Department of Computer Science and Engineering, JIS University" },
        { "name": "Vivek Yadav", "affiliation": "Department of Computer Science and Engineering, JIS University" },
        { "name": "Piyali Sarkar", "affiliation": "Department of Computer Science and Engineering, JIS University" },
        { "name": "Sonali Bhowmik", "affiliation": "Department of Computer Science and Engineering, JIS University" },
        { "name": "Dipankar Misra", "affiliation": "Department of Computer Science and Engineering, JIS University" },
        { "name": "Sumit Nandi", "affiliation": "Harishchandrapur College, Malda" }
      ],
      "researchStatus": "released",
      "reviewStatus": "not-reviewed",
      "releasedAt": "2025-06-01",
      "paperUrl": "https://artefacts-discovery.researcher.life/full_text/DA-2/32/326151b325b83d9cad2c965f7146b37b/full_text/6dd33d2ab3e8a75dd7c06626d2651050.pdf",
      "doi": null,
      "technicalReportInstitution": null,
      "technicalReportNumber": null,
      "journalTitle": "International Journal of Enhanced Research in Science, Technology & Engineering",
      "issn": "2319-7463",
      "volume": "14",
      "issue": "6",
      "firstPage": "212",
      "lastPage": "226",
      "pdfUrl": "https://artefacts-discovery.researcher.life/full_text/DA-2/32/326151b325b83d9cad2c965f7146b37b/full_text/6dd33d2ab3e8a75dd7c06626d2651050.pdf",
      "codeUrl": "https://github.com/elixpo/octabit",
      "artifacts": [
        { "kind": "paper", "label": "Published 8-bit CPU paper", "url": "https://artefacts-discovery.researcher.life/full_text/DA-2/32/326151b325b83d9cad2c965f7146b37b/full_text/6dd33d2ab3e8a75dd7c06626d2651050.pdf", "license": null },
        { "kind": "hardware", "label": "OctaBit source, schematics, and hardware documentation", "url": "https://github.com/elixpo/octabit", "license": "MIT" }
      ],
      "liveDemos": [],
      "licenses": [
        { "artifact": "source code and repository hardware material", "license": "MIT", "url": "https://github.com/elixpo/octabit/blob/main/LICENSE" },
        { "artifact": "published paper", "license": "No reuse license stated in the supplied paper", "url": "https://artefacts-discovery.researcher.life/full_text/DA-2/32/326151b325b83d9cad2c965f7146b37b/full_text/6dd33d2ab3e8a75dd7c06626d2651050.pdf" }
      ],
      "reproducibility": { "status": "partial", "summary": "The repository publishes implementation code, component documentation, schematics, and EEPROM tooling, but Elixpo has not independently reproduced the complete paper-specific hardware build." },
      "citation": { "text": "Bhattacharya, Chakraborty, Yadav, Sarkar, Bhowmik, Misra, and Nandi. Exploring Microcode CPU Instructions with RISC 8-Bit Breadboard Computer. International Journal of Enhanced Research in Science, Technology & Engineering 14(6), 212–226 (2025).", "cffUrl": null },
      "metadataCompleteness": "verified"
    },
    "emoji_transnetv1": {
      "slug": "emoji-transnet",
      "title": "Emoji Contextual Translator",
      "abstract": "An archived T5 fine-tuning experiment that translates emoji-rich sentences into plain-English descriptions and includes inference and ROUGE evaluation scripts.",
      "authors": [],
      "researchStatus": "archived",
      "reviewStatus": "not-reviewed",
      "releasedAt": null,
      "paperUrl": null,
      "codeUrl": "https://github.com/elixpo/emoji_transnetv1",
      "artifacts": [{ "kind": "model", "label": "Emoji Contextual Translator model", "url": "https://huggingface.co/elixpo/Emoji-Contextual-Translator", "license": "MIT" }],
      "liveDemos": [],
      "licenses": [{ "artifact": "released Hugging Face model", "license": "MIT", "url": "https://huggingface.co/elixpo/Emoji-Contextual-Translator" }],
      "reproducibility": { "status": "partial", "summary": "The repository documents dependencies, inference, training, and ROUGE evaluation, but does not provide a complete version-pinned reproduction environment." },
      "citation": null,
      "metadataCompleteness": "legacy-partial"
    },
    "falcon": {
      "slug": "falcon",
      "title": "Falcon High-Altitude Commit Engine",
      "abstract": "A completed automation experiment that used Git plumbing to produce a deliberately large repository history and contribution-graph pattern. It is preserved as an experimental artifact, not an active research claim.",
      "authors": [],
      "researchStatus": "archived",
      "reviewStatus": "not-reviewed",
      "releasedAt": "2026-04-01",
      "paperUrl": null,
      "codeUrl": "https://github.com/elixpo/falcon",
      "artifacts": [],
      "liveDemos": [],
      "licenses": [],
      "reproducibility": { "status": "not-documented", "summary": "The repository preserves the resulting history and a high-level implementation description, but no supported reproduction protocol is published." },
      "citation": null,
      "metadataCompleteness": "legacy-partial"
    },
    "monodiffuse": {
      "slug": "monodiffuse",
      "title": "Native Binary-Weight Training Outperforms Zero-Shot Sign Projection in MNIST Diffusion",
      "abstract": "A controlled study of one-bit-weight diffusion training that separates binary representational limits from post-training projection failure using matched residual U-Net experiments, repeated seeds, controls, hashes, and runnable artifacts.",
      "authors": [{ "name": "Ayushman Bhattacharya", "affiliation": "Pollinations AI" }, { "name": "Anwesha Chakraborty", "affiliation": "JIS University" }, { "name": "Nihal Gazi", "affiliation": "IEM" }],
      "researchStatus": "preprint",
      "reviewStatus": "not-peer-reviewed",
      "releasedAt": "2026-10-17",
      "paperUrl": "https://doi.org/10.5281/zenodo.23424654",
      "doi": "10.5281/zenodo.23424654",
      "pdfUrl": "https://zenodo.org/records/23424654/files/monodiffuse-preprint.pdf",
      "technicalReportInstitution": "MonoDiffuse Project",
      "technicalReportNumber": "MonoDiffuse-TR-2026-01",
      "codeUrl": "https://github.com/elixpo/monodiffuse",
      "artifacts": [{ "kind": "model", "label": "MonoDiffuse model artifacts", "url": "https://huggingface.co/Elixpo/monodiffuse", "license": "MIT" }],
      "liveDemos": [{ "name": "Diffuino Live", "description": "Run the public MNIST diffusion demonstration backed by released ONNX and binary-network model artifacts.", "url": "https://huggingface.co/spaces/elixpo/diffuino", "tags": ["Diffusion", "ONNX", "Binary neural network"] }],
      "licenses": [{ "artifact": "software and model release", "license": "MIT", "url": "https://github.com/elixpo/monodiffuse/blob/main/LICENSE" }],
      "reproducibility": { "status": "documented", "summary": "The repository provides exact commands, controls, three-seed artifacts, hashes, publication packaging, and a versioned citation record." },
      "citation": { "text": "Bhattacharya, Chakraborty, and Gazi. Native Binary-Weight Training Outperforms Zero-Shot Sign Projection in MNIST Diffusion. MonoDiffuse Technical Report 2026-01 (2026). https://doi.org/10.5281/zenodo.23424654", "cffUrl": "https://github.com/elixpo/monodiffuse/blob/main/CITATION.cff" },
      "metadataCompleteness": "verified"
    },
    "search.elixpo": {
      "slug": "oreolook",
      "title": "A Three-Layer Caching Architecture for Low-Latency LLM Web Search on Commodity CPU Hardware",
      "abstract": "OreoLook presents a three-layer cache for session context, semantically equivalent queries, and URL embeddings in an open LLM answer engine operating on commodity CPU infrastructure.",
      "authors": [{ "name": "Ayushman Bhattacharya", "affiliation": null }, { "name": "Nihal Gazi", "affiliation": null }],
      "researchStatus": "preprint",
      "reviewStatus": "not-peer-reviewed",
      "releasedAt": "2026-08-12",
      "paperUrl": "https://arxiv.org/abs/2609.05463",
      "doi": "10.48550/arXiv.2609.05463",
      "technicalReportInstitution": null,
      "technicalReportNumber": null,
      "codeUrl": "https://github.com/pollinations/search.elixpo",
      "artifacts": [{ "kind": "dataset", "label": "OreoLook research evaluations", "url": "https://huggingface.co/datasets/p-research/oreolook-research-evals", "license": "CC BY 4.0" }],
      "liveDemos": [{ "name": "OreoLook", "description": "Run cited web research and structured report generation through the public OreoLook demonstration.", "url": "https://huggingface.co/spaces/Elixpo/OreoLook", "tags": ["Cited search", "Research agents", "Gradio"] }],
      "licenses": [{ "artifact": "evaluation dataset", "license": "CC BY 4.0", "url": "https://huggingface.co/datasets/p-research/oreolook-research-evals" }],
      "reproducibility": { "status": "partial", "summary": "The implementation, interactive Space, paper, and evaluation dataset are public; the arXiv record states that code availability is by request, so the complete paper-specific reproduction path is not yet documented." },
      "citation": { "text": "Bhattacharya and Gazi. A Three-Layer Caching Architecture for Low-Latency LLM Web Search on Commodity CPU Hardware. arXiv:2609.05463 (2026).", "cffUrl": null },